{
  "$comment": "A minimal planar multibond catalog slice (C-MB1): RigidBody2D declares model dimension 2 and one Planar port in the `body` frame. The two multibond domains carry their per-component units, angular first (D-MB2).",
  "language": "0.1.0",
  "blocks": [
    {
      "ref": "stdlib:planar/RigidBody2D",
      "name": "RigidBody2D",
      "group": "2D multibond",
      "release": "0.3",
      "description": "Planar rigid body with one multibond port in the body frame (D-MB4).",
      "icon": "mb-rigid-body-2d",
      "dimension": 2,
      "constants": [],
      "parameters": [
        {
          "name": "m",
          "type": "Real",
          "default": "1.0",
          "unit": "kg",
          "min": 0,
          "max": null,
          "tunable": false,
          "description": "Body mass",
          "options": null
        },
        {
          "name": "J",
          "type": "Real",
          "default": "0.01",
          "unit": "kg*m^2",
          "min": 0,
          "max": null,
          "tunable": false,
          "description": "Moment of inertia about the body z axis",
          "options": null
        }
      ],
      "inputs": [],
      "outputs": [],
      "ports": [
        {
          "name": "p",
          "domain": "Planar",
          "size": [
            3
          ],
          "frame": "body"
        }
      ],
      "variables": [
        {
          "name": "P",
          "type": "Real",
          "size": [
            3
          ],
          "unit": null,
          "start": "[0.0, 0.0, 0.0]",
          "state": "prefer"
        }
      ],
      "causality": [
        {
          "ports": [
            "p"
          ],
          "kind": "preferred",
          "value": "flow_out"
        }
      ],
      "source": "@block RigidBody2D begin\n    @ports p::Power{Planar}, [frame = \"body\"]\n    @parameters begin\n        m::Real = 1.0, [unit = \"kg\", min = 0, description = \"Body mass\"]\n        J::Real = 0.01, [unit = \"kg*m^2\", min = 0, description = \"Moment of inertia about the body z axis\"]\n    end\n    # Per-component units differ (torque impulse vs linear momentum), so the unit is left\n    # open here and supplied component-wise by the compiler (J-MB2).\n    @variables P::Vec{3} = [0.0, 0.0, 0.0], [state = :prefer, description = \"Momentum\"]\n    @equations begin\n        # The numeric core is component-wise (D-MB10); M lives only in I (D-MB3).\n        for k in 1:3\n            ddt(P[k]) ~ p.e[k]\n        end\n        p.f[1] ~ P[1] / J\n        p.f[2] ~ P[2] / m\n        p.f[3] ~ P[3] / m\n    end\n    @causality p => :flow_out\nend",
      "path": "stdlib/planar/RigidBody2D.jl"
    }
  ],
  "junctions": [
    {
      "ref": "junction:0"
    },
    {
      "ref": "junction:1"
    }
  ],
  "domains": [
    {
      "name": "Planar",
      "effort": {
        "name": "wrench",
        "unit": "N*m"
      },
      "flow": {
        "name": "twist",
        "unit": "rad/s"
      },
      "across": "f",
      "size": 3,
      "components": {
        "effort": ["N*m", "N", "N"],
        "flow": ["rad/s", "m/s", "m/s"]
      }
    },
    {
      "name": "Spatial",
      "effort": {
        "name": "wrench",
        "unit": "N*m"
      },
      "flow": {
        "name": "twist",
        "unit": "rad/s"
      },
      "across": "f",
      "size": 6,
      "components": {
        "effort": ["N*m", "N*m", "N*m", "N", "N", "N"],
        "flow": ["rad/s", "rad/s", "rad/s", "m/s", "m/s", "m/s"]
      }
    }
  ]
}
